{
  "asset_id": "AST-CHAR-004",
  "version": "v001",
  "status": "approved",
  "approval_date": "2026-08-18",
  "approval_evidence_path": "characters/ast-char-004-sister-aneth-source-v001.md",
  "drive_file_id": "1yJErhP5P6eNAEIUBfjfTOsUERi6CbT0W",
  "github_source_path": "characters/ast-char-004-sister-aneth-source-v001.md",
  "github_export_path": "exports/ast-char-004-sister-aneth-master-v001.md",
  "master": {
    "system": "google_drive",
    "drive_file_id": "1yJErhP5P6eNAEIUBfjfTOsUERi6CbT0W",
    "hash": {
      "algorithm": "sha256",
      "value": "1315736c793e2f3ff0bf05405a83e55664f250252298339f963f9c670a254236"
    }
  },
  "source_hash": {
    "algorithm": "git-blob-sha1",
    "value": "efdd4fd5082b9ce09bd20c4dbfc930cab44fc908"
  },
  "export_hash": {
    "algorithm": "git-blob-sha1",
    "value": "8d3e4f27f2d6cfc09e5b82a6c07ffd0e7c8e293e"
  }
}
